{
  "schemaVersion": 1,
  "packId": "eng.MRK-7-1-8",
  "source": "C-13 data/rights/records.json",
  "sources": [
    {
      "id": "FIATranslationGuide@eb74445",
      "collection": "FIATranslationGuide",
      "revision": "eb744452eb8d7c852caadde9d3181cddfe571119",
      "holders": [
        "Word Collective",
        "Mission Mutual"
      ],
      "licence": {
        "name": "CC BY-SA 4.0 license",
        "url": "https://creativecommons.org/licenses/by-sa/4.0/legalcode.en"
      },
      "url": "https://github.com/BibleAquifer/FIATranslationGuide",
      "discrepancies": []
    },
    {
      "id": "FIAKeyTerms@a392606",
      "collection": "FIAKeyTerms",
      "revision": "a39260670bba9d87d902e0fa0ae447341343481f",
      "holders": [
        "Word Collective",
        "Mission Mutual"
      ],
      "licence": {
        "name": "CC BY-SA 4.0 license",
        "url": "https://creativecommons.org/licenses/by-sa/4.0/legalcode.en"
      },
      "url": "https://github.com/BibleAquifer/FIAKeyTerms",
      "discrepancies": [
        "license_info.title (\"Familiarization, Internalization, Articulation (Fia) Terms\") differs from resource title (\"Familiarization, Internalization, Articulation (FIA) Key Terms\")"
      ]
    },
    {
      "id": "FIAImages@136ff7c",
      "collection": "FIAImages",
      "revision": "136ff7c6b2381b84d241e27524005dcad71424ba",
      "holders": [
        "Word Collective",
        "Mission Mutual"
      ],
      "licence": {
        "name": "CC BY-SA 4.0 license",
        "url": "https://creativecommons.org/licenses/by-sa/4.0/legalcode.en"
      },
      "url": "https://github.com/BibleAquifer/FIAImages",
      "discrepancies": []
    },
    {
      "id": "BereanStandardBible@87858d1",
      "collection": "BereanStandardBible",
      "revision": "87858d1e28ab728249d9fb50667170c194c6b013",
      "holders": [
        "Berean Standard Bible"
      ],
      "licence": {
        "name": "Public Domain CC0",
        "url": "https://creativecommons.org/public-domain/cc0/"
      },
      "url": "https://github.com/BibleAquifer/BereanStandardBible",
      "discrepancies": []
    },
    {
      "id": "unfoldingWordLiteral@e49bdf4",
      "collection": "unfoldingWordLiteral",
      "revision": "e49bdf4a0ddcdfe17428ca23e6dada29f54c0ea6",
      "holders": [
        "unfoldingWord"
      ],
      "licence": {
        "name": "CC BY-SA 4.0",
        "url": "https://creativecommons.org/licenses/by-sa/4.0/legalcode.en"
      },
      "url": "https://github.com/BibleAquifer/unfoldingWordLiteral",
      "discrepancies": []
    },
    {
      "id": "unfoldingWordSimplified@41a5b93",
      "collection": "unfoldingWordSimplified",
      "revision": "41a5b938d4f170278f8e43e7dce4df9e87e7a4bd",
      "holders": [
        "unfoldingWord"
      ],
      "licence": {
        "name": "CC BY-SA 4.0",
        "url": "https://creativecommons.org/licenses/by-sa/4.0/legalcode.en"
      },
      "url": "https://github.com/BibleAquifer/unfoldingWordSimplified",
      "discrepancies": []
    },
    {
      "id": "WorldEnglishBible@bcb8b3e",
      "collection": "WorldEnglishBible",
      "revision": "bcb8b3edfb302863c241e3d1d2062cf51042d694",
      "holders": [
        "Public Domain"
      ],
      "licence": {
        "name": "Public Domain CC0",
        "url": "https://creativecommons.org/public-domain/cc0/"
      },
      "url": "https://github.com/BibleAquifer/WorldEnglishBible",
      "discrepancies": []
    },
    {
      "id": "WorldEnglishBibleUpdated@e8b8f85",
      "collection": "WorldEnglishBibleUpdated",
      "revision": "e8b8f852167379ff0a4e82032c444c12f56a2173",
      "holders": [
        "Public Domain"
      ],
      "licence": {
        "name": "Public Domain CC0",
        "url": "https://creativecommons.org/public-domain/cc0/"
      },
      "url": "https://github.com/BibleAquifer/WorldEnglishBibleUpdated",
      "discrepancies": []
    }
  ]
}
