{
  "schemaVersion": 1,
  "packId": "spa.MRK-16-1-8",
  "source": "C-13 data/rights/records.json",
  "sources": [
    {
      "id": "FIATranslationGuide@eb74445",
      "collection": "FIATranslationGuide",
      "revision": "eb744452eb8d7c852caadde9d3181cddfe571119",
      "holders": [
        "Word Collective",
        "Mission Mutual"
      ],
      "licence": {
        "name": "CC BY-SA 4.0 license",
        "url": "https://creativecommons.org/licenses/by-sa/4.0/legalcode.en"
      },
      "url": "https://github.com/BibleAquifer/FIATranslationGuide",
      "discrepancies": []
    },
    {
      "id": "FIAKeyTerms@a392606",
      "collection": "FIAKeyTerms",
      "revision": "a39260670bba9d87d902e0fa0ae447341343481f",
      "holders": [
        "Word Collective",
        "Mission Mutual"
      ],
      "licence": {
        "name": "CC BY-SA 4.0 license",
        "url": "https://creativecommons.org/licenses/by-sa/4.0/legalcode.en"
      },
      "url": "https://github.com/BibleAquifer/FIAKeyTerms",
      "discrepancies": [
        "license_info.title (\"Familiarization, Internalization, Articulation (Fia) Terms\") differs from resource title (\"Familiarization, Internalization, Articulation (FIA) Key Terms\")"
      ]
    },
    {
      "id": "FIAImages@136ff7c",
      "collection": "FIAImages",
      "revision": "136ff7c6b2381b84d241e27524005dcad71424ba",
      "holders": [
        "Word Collective",
        "Mission Mutual"
      ],
      "licence": {
        "name": "CC BY-SA 4.0 license",
        "url": "https://creativecommons.org/licenses/by-sa/4.0/legalcode.en"
      },
      "url": "https://github.com/BibleAquifer/FIAImages",
      "discrepancies": []
    },
    {
      "id": "FIAMaps@4bc9bb9",
      "collection": "FIAMaps",
      "revision": "4bc9bb9f1d9082e5d71a047a35bf8e608f473602",
      "holders": [
        "Biblica",
        "Word Collective",
        "Mission Mutual"
      ],
      "licence": {
        "name": "CC BY-SA 4.0 license",
        "url": "https://creativecommons.org/licenses/by-sa/4.0/legalcode.en"
      },
      "url": "https://github.com/BibleAquifer/FIAMaps",
      "discrepancies": [
        "holder differs between license_info (\"Biblica\") and adaptation_notice (\"Word Collective\")"
      ]
    },
    {
      "id": "VideoBibleDictionary@1c02713",
      "collection": "VideoBibleDictionary",
      "revision": "1c02713d022bd96a29c78f5b75455315d6d35a6e",
      "holders": [
        "Word Collective",
        "Mission Mutual"
      ],
      "licence": {
        "name": "CC BY-SA 4.0 license",
        "url": "https://creativecommons.org/licenses/by-sa/4.0/legalcode.en"
      },
      "url": "https://github.com/BibleAquifer/VideoBibleDictionary",
      "discrepancies": [
        "license_info.title (\"Video Bible Dictionary\") differs from resource title (\"Familiarization, Internalization, Articulation (FIA) Videos\")"
      ]
    },
    {
      "id": "ReinaValera1909@84a0713",
      "collection": "ReinaValera1909",
      "revision": "84a071324be17c7c66db17dd204d7804e66d728b",
      "holders": [
        "Public Domain"
      ],
      "licence": {
        "name": "Public Domain CC0",
        "url": "https://creativecommons.org/public-domain/cc0/"
      },
      "url": "https://github.com/BibleAquifer/ReinaValera1909",
      "discrepancies": []
    },
    {
      "id": "AquiferSpanishBibleReferenceText@edf50fc",
      "collection": "AquiferSpanishBibleReferenceText",
      "revision": "edf50fc7913b15df1089534cb9bca084553acbef",
      "holders": [
        "Mission Mutual"
      ],
      "licence": {
        "name": "CC BY-SA 4.0 license",
        "url": "https://creativecommons.org/licenses/by-sa/4.0/legalcode.en"
      },
      "url": "https://github.com/BibleAquifer/AquiferSpanishBibleReferenceText",
      "discrepancies": []
    }
  ]
}
