{
  "schemaVersion": 1,
  "packId": "spa.MRK-12-28-34",
  "source": "C-13 data/rights/records.json",
  "sources": [
    {
      "id": "FIATranslationGuide@eb74445",
      "collection": "FIATranslationGuide",
      "revision": "eb744452eb8d7c852caadde9d3181cddfe571119",
      "holders": [
        "Word Collective",
        "Mission Mutual"
      ],
      "licence": {
        "name": "CC BY-SA 4.0 license",
        "url": "https://creativecommons.org/licenses/by-sa/4.0/legalcode.en"
      },
      "url": "https://github.com/BibleAquifer/FIATranslationGuide",
      "discrepancies": []
    },
    {
      "id": "FIAKeyTerms@a392606",
      "collection": "FIAKeyTerms",
      "revision": "a39260670bba9d87d902e0fa0ae447341343481f",
      "holders": [
        "Word Collective",
        "Mission Mutual"
      ],
      "licence": {
        "name": "CC BY-SA 4.0 license",
        "url": "https://creativecommons.org/licenses/by-sa/4.0/legalcode.en"
      },
      "url": "https://github.com/BibleAquifer/FIAKeyTerms",
      "discrepancies": [
        "license_info.title (\"Familiarization, Internalization, Articulation (Fia) Terms\") differs from resource title (\"Familiarization, Internalization, Articulation (FIA) Key Terms\")"
      ]
    },
    {
      "id": "ReinaValera1909@84a0713",
      "collection": "ReinaValera1909",
      "revision": "84a071324be17c7c66db17dd204d7804e66d728b",
      "holders": [
        "Public Domain"
      ],
      "licence": {
        "name": "Public Domain CC0",
        "url": "https://creativecommons.org/public-domain/cc0/"
      },
      "url": "https://github.com/BibleAquifer/ReinaValera1909",
      "discrepancies": []
    },
    {
      "id": "AquiferSpanishBibleReferenceText@edf50fc",
      "collection": "AquiferSpanishBibleReferenceText",
      "revision": "edf50fc7913b15df1089534cb9bca084553acbef",
      "holders": [
        "Mission Mutual"
      ],
      "licence": {
        "name": "CC BY-SA 4.0 license",
        "url": "https://creativecommons.org/licenses/by-sa/4.0/legalcode.en"
      },
      "url": "https://github.com/BibleAquifer/AquiferSpanishBibleReferenceText",
      "discrepancies": []
    }
  ]
}
